{
  "$schema": "../schemas/preferences.schema.json",
  "version": "1.0",
  "last_updated": "2025-01-18T00:00:00Z",
  "coding_preferences": {
    "languages": {
      "primary": ["TypeScript", "Python"],
      "secondary": []
    },
    "patterns": {
      "preferred": ["functional", "immutable", "composition"],
      "avoid": ["deep-inheritance", "mutation", "any-types"]
    },
    "testing": {
      "approach": "TDD when appropriate",
      "coverage_target": 80,
      "framework_preferences": {}
    }
  },
  "tool_preferences": {
    "formatter": "prettier",
    "linter": "eslint",
    "package_manager": "pnpm"
  },
  "learned_preferences": []
}
